{"$defs":{"CompatibilityRange":{"additionalProperties":false,"properties":{"maximum_druff_contract":{"title":"Maximum Druff Contract","type":"string"},"minimum_druff_contract":{"title":"Minimum Druff Contract","type":"string"}},"required":["minimum_druff_contract","maximum_druff_contract"],"title":"CompatibilityRange","type":"object"},"ContractIdentity":{"additionalProperties":false,"properties":{"id":{"const":"io.dander.control.contracts/v1","title":"Id","type":"string"},"sha256":{"pattern":"^[0-9a-f]{64}$","title":"Sha256","type":"string"}},"required":["id","sha256"],"title":"ContractIdentity","type":"object"},"ControlLimits":{"additionalProperties":false,"properties":{"max_graph_bytes":{"exclusiveMinimum":0,"title":"Max Graph Bytes","type":"integer"},"max_log_records":{"exclusiveMinimum":0,"title":"Max Log Records","type":"integer"},"max_page_size":{"exclusiveMinimum":0,"title":"Max Page Size","type":"integer"}},"required":["max_graph_bytes","max_page_size","max_log_records"],"title":"ControlLimits","type":"object"}},"$id":"urn:dander:control:contracts:v1:capabilities","$schema":"https://json-schema.org/draft/2020-12/schema","additionalProperties":false,"properties":{"api_version":{"const":"v1","default":"v1","title":"Api Version","type":"string"},"compatibility":{"$ref":"#/$defs/CompatibilityRange"},"contract":{"$ref":"#/$defs/ContractIdentity"},"dander_version":{"title":"Dander Version","type":"string"},"limits":{"$ref":"#/$defs/ControlLimits"},"operations":{"items":{"enum":["graph.read","graph.edit","graph.delete","graph.validate","graph.change-preview","deployment.preview","run.start","run.read","run.explain","run.logs","run.cancel","run.replay"],"type":"string"},"title":"Operations","type":"array"}},"required":["dander_version","contract","compatibility","operations","limits"],"title":"CapabilitiesResponse","type":"object"}
