{"api_version":"v1","compatibility":{"maximum_druff_contract":"1.x","minimum_druff_contract":"1.0.0"},"contract":{"id":"io.dander.control.contracts/v1","sha256":"0000000000000000000000000000000000000000000000000000000000000000"},"dander_version":"0.0.0","limits":{"max_graph_bytes":5242880,"max_log_records":500,"max_page_size":100},"operations":["graph.read","graph.edit","graph.validate","graph.change-preview","run.read","run.explain"]}
